{
	"format": 1,
	"design": "designs/board.design.json",
	"name": "Board game boards",
	"cards": [
		{ "id": "road-trip" },
		{
			"id": "road-trip-night",
			"title": "Road Trip Night Ride",
			"subtitle": "The same road, after dark",
			"c_paper": "#2E2A4F",
			"c_ink": "#1C1A33",
			"c_frame": "#F7B267",
			"c_panel": "#3D3868",
			"c_text": "#F6F1FF",
			"c_accent": "#F7B267",
			"c_plain": "#ECE8FF",
			"c_start": "#7BE0A5",
			"c_finish": "#FFD166",
			"c_safe": "#76CFF0",
			"c_skip": "#F28B9C",
			"c_back": "#F4A261",
			"c_forward": "#A8E6A1",
			"c_shortcut": "#BCA3FF",
			"c_dare": "#FF9CCB",
			"tiles": {
				"1": { "text": "Count the stars" },
				"4": { "kind": "dare", "text": "Hoot like an owl" },
				"11": { "kind": "safe", "text": "Campfire stop, safe" },
				"20": { "kind": "skip", "text": "Fog bank, miss a turn" },
				"26": { "text": "Check the headlights" }
			},
			"rules": [
				{ "text": "Everyone puts a pawn on START." },
				{ "text": "Roll, move clockwise and follow the tile." },
				{ "text": "Safe zones protect you from going back." },
				{ "text": "Land on FINISH to win the night." }
			],
			"foot": "Print on A3 landscape at 100 %. Same board, new mood: the night card changes only five tiles."
		},
		{
			"id": "moon-base",
			"title": "Moon Base Dash",
			"subtitle": "Be the first crew to reach the lunar base",
			"c_paper": "#1B2140",
			"c_ink": "#17182B",
			"c_frame": "#F3C969",
			"c_panel": "#2A3260",
			"c_text": "#F4F1FF",
			"c_accent": "#F3C969",
			"c_plain": "#E8ECFF",
			"c_start": "#7FE0A8",
			"c_finish": "#FFD166",
			"c_safe": "#74D3F0",
			"c_skip": "#F28B9C",
			"c_back": "#F7A072",
			"c_forward": "#A8E6A1",
			"c_shortcut": "#BFA3FF",
			"c_dare": "#FF9CCB",
			"foot": "Print on A3 landscape, no scaling. Needs one die and some pawns. Safe flight!",
			"tiles": [
				{ "kind": "start", "text": "Start: launch pad", "n": 0 },
				{ "kind": "plain", "text": "Introduce your crew", "n": 0 },
				{ "kind": "plain", "text": "Name a planet", "n": 0 },
				{ "kind": "dare", "text": "Moon dust, step lightly", "n": 0 },
				{ "kind": "plain", "text": "Radio check, wave", "n": 0 },
				{ "kind": "safe", "text": "Airlock, safe", "n": 0 },
				{ "kind": "plain", "text": "Float for 5 seconds", "n": 0 },
				{ "kind": "back", "text": "Meteor shower", "n": 3 },
				{ "kind": "plain", "text": "Fix the antenna", "n": 0 },
				{ "kind": "skip", "text": "Solar flare, miss a turn", "n": 0 },
				{ "kind": "forward", "text": "Boost engines", "n": 3 },
				{ "kind": "plain", "text": "Describe zero gravity", "n": 0 },
				{ "kind": "shortcut", "text": "Wormhole!", "n": 27 },
				{ "kind": "dare", "text": "Alien snack time", "n": 0 },
				{ "kind": "plain", "text": "Speak in robot voice", "n": 0 },
				{ "kind": "plain", "text": "Comet tail ride", "n": 0 },
				{ "kind": "safe", "text": "Docking bay, safe", "n": 0 },
				{ "kind": "plain", "text": "Name a star pattern", "n": 0 },
				{ "kind": "dare", "text": "Cosmic hiccup", "n": 0 },
				{ "kind": "back", "text": "Asteroid field", "n": 4 },
				{ "kind": "plain", "text": "Salute the commander", "n": 0 },
				{ "kind": "plain", "text": "Black hole edge", "n": 0 },
				{ "kind": "plain", "text": "Cargo jam", "n": 0 },
				{ "kind": "dare", "text": "Space walk dance", "n": 0 },
				{ "kind": "skip", "text": "Low oxygen, miss a turn", "n": 0 },
				{ "kind": "safe", "text": "Observatory, safe", "n": 0 },
				{ "kind": "dare", "text": "Invent an alien greeting", "n": 0 },
				{ "kind": "plain", "text": "Gravity glitch", "n": 0 },
				{ "kind": "shortcut", "text": "Warp lane", "n": 38 },
				{ "kind": "plain", "text": "Mission report", "n": 0 },
				{ "kind": "back", "text": "Engine trouble", "n": 2 },
				{ "kind": "plain", "text": "Spin the satellite", "n": 0 },
				{ "kind": "dare", "text": "Rover race", "n": 0 },
				{ "kind": "plain", "text": "Space selfie", "n": 0 },
				{ "kind": "forward", "text": "Slingshot", "n": 2 },
				{ "kind": "plain", "text": "Dust storm", "n": 0 },
				{ "kind": "safe", "text": "Fuel stop, safe", "n": 0 },
				{ "kind": "plain", "text": "Cheer for base control", "n": 0 },
				{ "kind": "plain", "text": "Final approach", "n": 0 },
				{ "kind": "finish", "text": "Finish: moon base", "n": 0 }
			]
		},
		{
			"id": "beach-party",
			"title": "Beach Party Run",
			"subtitle": "Sun, sand and silly challenges",
			"c_paper": "#BFEFEA",
			"c_ink": "#124A55",
			"c_frame": "#124A55",
			"c_panel": "#FFF8E7",
			"c_text": "#124A55",
			"c_accent": "#E4572E",
			"c_plain": "#FFFFFF",
			"c_start": "#8BE08F",
			"c_finish": "#FFD23F",
			"c_safe": "#8FD6FF",
			"c_skip": "#FF9AA2",
			"c_back": "#FFB067",
			"c_forward": "#C7F0A8",
			"c_shortcut": "#D6B8FF",
			"c_dare": "#FFA6D5",
			"tiles": [
				{ "kind": "start", "text": "Start: sunscreen on", "n": 0 },
				{ "kind": "plain", "text": "Build a sand castle pose", "n": 0 },
				{ "kind": "plain", "text": "Name 3 ice cream flavors", "n": 0 },
				{ "kind": "dare", "text": "Wave like a lifeguard", "n": 0 },
				{ "kind": "plain", "text": "Seagull dance", "n": 0 },
				{ "kind": "safe", "text": "Shady umbrella, safe", "n": 0 },
				{ "kind": "plain", "text": "Tell a vacation joke", "n": 0 },
				{ "kind": "back", "text": "Big wave!", "n": 3 },
				{ "kind": "dare", "text": "Act out a surfer", "n": 0 },
				{ "kind": "skip", "text": "Sunburn, miss a turn", "n": 0 },
				{ "kind": "forward", "text": "Tailwind boat", "n": 2 },
				{ "kind": "plain", "text": "Describe your dream island", "n": 0 },
				{ "kind": "shortcut", "text": "Hidden path", "n": 33 },
				{ "kind": "dare", "text": "Crab walk, 3 steps", "n": 0 },
				{ "kind": "plain", "text": "Beach volleyball cheer", "n": 0 },
				{ "kind": "plain", "text": "Shell hunt", "n": 0 },
				{ "kind": "safe", "text": "Palm tree, safe", "n": 0 },
				{ "kind": "plain", "text": "Name 3 fish", "n": 0 },
				{ "kind": "dare", "text": "Tangled towel", "n": 0 },
				{ "kind": "back", "text": "Jellyfish alert", "n": 2 },
				{ "kind": "plain", "text": "Compliment your neighbor", "n": 0 },
				{ "kind": "plain", "text": "Cliff jump", "n": 0 },
				{ "kind": "back", "text": "Cooler is empty", "n": 3 },
				{ "kind": "shortcut", "text": "Limbo pose", "n": 38 },
				{ "kind": "skip", "text": "Lost flip flop, miss a turn", "n": 0 },
				{ "kind": "safe", "text": "Lighthouse, safe", "n": 0 },
				{ "kind": "dare", "text": "Sing a summer hit", "n": 0 },
				{ "kind": "forward", "text": "Drifting raft", "n": 3 },
				{ "kind": "plain", "text": "Speedboat", "n": 0 },
				{ "kind": "plain", "text": "Postcard time", "n": 0 },
				{ "kind": "back", "text": "Rip current", "n": 5 },
				{ "kind": "plain", "text": "Spin the beach ball", "n": 0 },
				{ "kind": "dare", "text": "Sandy snack", "n": 0 },
				{ "kind": "plain", "text": "Sunset photo", "n": 0 },
				{ "kind": "forward", "text": "Shortcut ferry", "n": 2 },
				{ "kind": "plain", "text": "Thunder cloud", "n": 0 },
				{ "kind": "safe", "text": "Tide pool, safe", "n": 0 },
				{ "kind": "plain", "text": "Hula wiggle", "n": 0 },
				{ "kind": "plain", "text": "Almost at the dock", "n": 0 },
				{ "kind": "finish", "text": "Finish: beach party!", "n": 0 }
			]
		}
	]
}
