{
  "format": 1,
  "design": "designs/number.design.json",
  "name": "Number cards",
  "cards": [
    { "id": "AS", "rank": 1, "suit": "spades" },
    { "id": "2S", "rank": 2, "suit": "spades" },
    { "id": "3S", "rank": 3, "suit": "spades" },
    { "id": "4S", "rank": 4, "suit": "spades" },
    { "id": "5S", "rank": 5, "suit": "spades" },
    { "id": "6S", "rank": 6, "suit": "spades" },
    { "id": "7S", "rank": 7, "suit": "spades" },
    { "id": "8S", "rank": 8, "suit": "spades" },
    { "id": "9S", "rank": 9, "suit": "spades" },
    { "id": "10S", "rank": 10, "suit": "spades" },
    { "id": "AH", "rank": 1, "suit": "hearts" },
    { "id": "2H", "rank": 2, "suit": "hearts" },
    { "id": "3H", "rank": 3, "suit": "hearts" },
    { "id": "4H", "rank": 4, "suit": "hearts" },
    { "id": "5H", "rank": 5, "suit": "hearts" },
    { "id": "6H", "rank": 6, "suit": "hearts" },
    { "id": "7H", "rank": 7, "suit": "hearts" },
    { "id": "8H", "rank": 8, "suit": "hearts" },
    { "id": "9H", "rank": 9, "suit": "hearts" },
    { "id": "10H", "rank": 10, "suit": "hearts" },
    { "id": "AD", "rank": 1, "suit": "diamonds" },
    { "id": "2D", "rank": 2, "suit": "diamonds" },
    { "id": "3D", "rank": 3, "suit": "diamonds" },
    { "id": "4D", "rank": 4, "suit": "diamonds" },
    { "id": "5D", "rank": 5, "suit": "diamonds" },
    { "id": "6D", "rank": 6, "suit": "diamonds" },
    { "id": "7D", "rank": 7, "suit": "diamonds" },
    { "id": "8D", "rank": 8, "suit": "diamonds" },
    { "id": "9D", "rank": 9, "suit": "diamonds" },
    { "id": "10D", "rank": 10, "suit": "diamonds" },
    { "id": "AC", "rank": 1, "suit": "clubs" },
    { "id": "2C", "rank": 2, "suit": "clubs" },
    { "id": "3C", "rank": 3, "suit": "clubs" },
    { "id": "4C", "rank": 4, "suit": "clubs" },
    { "id": "5C", "rank": 5, "suit": "clubs" },
    { "id": "6C", "rank": 6, "suit": "clubs" },
    { "id": "7C", "rank": 7, "suit": "clubs" },
    { "id": "8C", "rank": 8, "suit": "clubs" },
    { "id": "9C", "rank": 9, "suit": "clubs" },
    { "id": "10C", "rank": 10, "suit": "clubs" }
  ]
}
